{
  "$schema": "https://json-schema.org/draft/2020-12/schema",
  "$id": "https://example.invalid/my-bot-2.0/game/heroes.schema.json",
  "title": "Current Home Village Hero catalog",
  "type": "object",
  "additionalProperties": false,
  "required": ["schema_version","as_of","home_village_hero_count","max_active_slots","active_slot_source_id","heroes"],
  "properties": {
    "schema_version": {"const": 1},
    "as_of": {"type":"string","format":"date"},
    "home_village_hero_count": {"const": 6},
    "max_active_slots": {"const": 4},
    "active_slot_source_id": {"type":"string"},
    "heroes": {"type":"array","minItems":6,"maxItems":6,"items":{"type":"object","required":["id","label","unlock_town_hall","unlock_source_id","source_confidence","movement","active_slot_eligible","catalog_status","fixture_ids"],"properties":{"id":{"type":"string"},"label":{"type":"string"},"unlock_town_hall":{"type":"integer","minimum":1},"unlock_source_id":{"type":"string"},"source_confidence":{"enum":["official-explicit","official-historical-context"]},"movement":{"enum":["ground","air","mode-dependent"]},"active_slot_eligible":{"const":true},"catalog_status":{"const":"current"},"fixture_ids":{"type":"array","minItems":1,"items":{"type":"string"}},"availability_date":{"type":"string","format":"date"},"source_note":{"type":"string"}}}}
  }
}
